{
  "_id": "651f1c2a9b3e4d5f6a7b8c9d",
  "schema_version": 1,
  "username": "owner_01",
  "email": "owner@example.com",
  "password_hash": "$argon2id$v=19$m=65536,t=3,p=4$c29tZXNhbHR2YWx1ZQ$ZmFrZS1oYXNoLWZvci1leGFtcGxlLW9ubHk",
  "display_name": "问卷创建者",
  "status": "active",
  "last_login_at": "2026-10-18T08:00:00Z",
  "created_at": "2026-09-01T02:00:00Z",
  "updated_at": "2026-10-18T08:00:00Z"
}
